{
  "$schema": "metaschema/strict_meta_schema.json#",
  "$id": "copynumber",
  "title": "WES Copynumber Output Files",
  "type": "object",
  "description": "Copy number output files.",
  "properties": {
    "copynumber_cnv_calls": {
      "$ref": "artifacts/artifact_text.json"
    },
    "copynumber_cnv_calls_tsv": {
      "$ref": "artifacts/artifact_tsv.json"
    }
  },
  "required": [
    "copynumber_cnv_calls",
    "copynumber_cnv_calls_tsv"
  ],
  "additionalProperties": false
}