{
  "$schema": "metaschema/strict_meta_schema.json#",
  "$id": "pair_metrics",
  "title": "WES Pair Metrics Files",
  "type": "object",
  "description": "Pair-level metrics for WES.",
  "additionalProperties": false,
  "properties": {
        "all_summaries": {
          "$ref": "artifacts/artifact_text.json"
        }
  },
  "required": ["all_summaries"]
}