{
  "$schema": "metaschema/strict_meta_schema.json#",
  "$id": "rnaseq_level1_analysis",
  "title": "RNAseq Level 1 Sample Analysis Output Files",
  "type": "object",
  "description": "RNAseq assay output files for a sample level 1 analysis.",
  "additionalProperties": false,
  "properties": {
    "cimac_id": {
        "$comment": "Id of a sample within this clinical trial, that this record is based upon.",
        "$ref": "sample.json#properties/cimac_id"
    },
    "star": {
      "$ref": "assays/components/ngs/rna/star.json"
    },
    "rseqc": {
      "$ref": "assays/components/ngs/rna/rseqc.json"
    },
    "salmon": {
      "$ref": "assays/components/ngs/rna/salmon.json"
    }
  },
  "required": [
    "cimac_id",
    "star",
    "rseqc",
    "salmon"
  ]
}