{
    "$schema": "metaschema/strict_meta_schema.json#",
    "$id": "hande_input",
    "title": "H & E Input Files",
    "type": "object",
    "description": "H & E assay input/output files.",
    "additionalProperties": false,
    "properties": {
      "image_file": {
        "$comment": "Path to the H & E image in SVS format.",
        "$ref": "artifacts/artifact_image.json"
      }
    },
    "required": ["image_file"]
  }