{
  "$schema": "metaschema/strict_meta_schema.json#",
  "$id": "mif_antibody",
  "title": "mIF antibody",
  "description": "Data specific to antibody preparation on the multiplex immunofluorescence platform.",
  "additionalProperties": false,
  "type": "object",
  "allOf": [{ "$ref": "assays/components/antibody.json" }],
  "properties": {
    "fluor_wavelength": {
      "description": "Wavelength registered for Alexa Fluor processing.",
      "type": "number"
    },
    "primary_ab_dilution": {
      "description": "Concentration ratio for primary antibody dilution.",
      "type": "string"
    },
    "dilutent": {
      "description": "Dilution agent used for antibody sample.",
      "type": "string"
    },
    "fluor_dilution": {
      "description": "Concentration ratio for fluor dilution agent.",
      "type": "string"
    },
    "antigen_retrieval_time": {
      "description": "Length of time needed for antigen retrieval.",
      "type": "string",
      "format": "time"
    },
    "primary_incubation_time": {
      "description": "Length of time for primary antibody incubation.",
      "type": "string",
      "format": "time"
    },
    "amplification_time": {
      "description": "Length of time required for amplified signal detection.",
      "type": "string",
      "format": "time"
    }
  },
  "required": [
    "fluor_wavelength",
    "primary_ab_dilution",
    "dilutent",
    "fluor_dilution",
    "antigen_retrieval_time",
    "primary_incubation_time",
    "amplification_time"
  ]
}
