{
    "$schema": "metaschema/strict_meta_schema.json#",
    "$id": "tcr_analysis",
    "title": "TCR Output Files",
    "description": "Output files generated from the TCRseq assay: TRA and TRB clones",
    "type": "object",
    "additionalProperties": false,
    "properties": {
        "tca_clone": {
            "$ref": "artifacts/artifact_csv.json"
        },
        "trb_clone": {
            "$ref": "artifacts/artifact_csv.json"
        }
    }
}