{
  "$schema": "metaschema/strict_meta_schema.json#",
  "$id": "neoantigen",
  "title": "WES Neoantigen Output Files",
  "type": "object",
  "description": "Neoantigen output files.",
  "properties": {
    "mhc_class_I_epitopes": {
      "$ref": "artifacts/artifact_tsv.json"
    },
    "mhc_class_II_epitopes": {
      "$ref": "artifacts/artifact_tsv.json"
    },
    "mhc_class_I_filtered_condensed_ranked": {
      "$ref": "artifacts/artifact_tsv.json"
    },
    "mhc_class_II_filtered_condensed_ranked": {
      "$ref": "artifacts/artifact_tsv.json"
    }
  },
  "required": [
    "mhc_class_I_epitopes",
    "mhc_class_I_filtered_condensed_ranked",
    "mhc_class_II_epitopes",
    "mhc_class_II_filtered_condensed_ranked"
  ],
  "additionalProperties": false
}