{
    "$schema": "metaschema/strict_meta_schema.json#",
    "$id": "cytof_e4412",
    "title": "CYTOF Run",
    "type": "object",
    "description": "Information about the acquisition and analysis CyTOF data for E4412 and similarly formatted trials.",
    "additionalProperties": false,
    "mergeStrategy": "objectMerge",
    "allOf": [
        { "$ref": "assays/cytof_assay_core.json"}
    ],
    "required": ["assay_creator", "batch_id", "records"],
    "properties": {
        "assay_creator": {"$ref": "assays/components/assay_core.json#properties/assay_creator"},
        "assay_run_id": {"$ref": "assays/cytof_assay_core.json#properties/assay_run_id"},
        "cytof_antibodies": {"$ref": "assays/cytof_assay_core.json#properties/cytof_antibodies"},
        "batch_id": {"$ref": "assays/cytof_assay_core.json#properties/batch_id"},
        "acquisition_buffer": {
            "description": "Cell staining buffer used for antibody and cell dilution.",
            "type": "string"
        },
        "debarcoding_protocol": {
            "description": "The strategy/kit used to barcode CyTOF samples, if any",
            "type": "string"
        },
        "source_fcs": {
            "type": "array",
            "items": {
                "$ref": "artifacts/artifact_fcs.json"
            }
        },
        "astrolabe_reports": {
            "$ref": "artifacts/artifact_zip.json"
        },
        "astrolabe_analysis": {
            "$ref": "artifacts/artifact_zip.json"
        },
        "participants": {
            "type": "array",
            "description": "A single data record from CyTOF assay batch.",
            "items": {
                "$ref": "assays/components/cytof/cytof_participant.json"
            },
            "mergeStrategy": "arrayMergeById",
            "mergeOptions": {
              "idRef": "cimac_participant_id"
            }
        }
    }
}

